{
  "feature_id": "feat-bob-analysis-pipeline",
  "objective": "Replace the static development-fixture data source with a real IBM Bob-powered analysis pipeline that reads only allowlisted Meridian source files, validates output through existing Zod schemas, and renders live results in the existing Review Workspace while keeping the fixture fallback clearly labelled.",
  "requirements": [
    {
      "id": "REQ-001",
      "description": "A Next.js Route Handler (app/api/analyze/route.ts) executes the Bob analysis server-side via POST. It reads only the allowlisted source files via readAllowedSources() and returns a JSON AnalysisBundle containing all five contracts (review, behavioral-contract, metadata, intent, guardrail-test) plus optional blast_radius.",
      "priority": "must"
    },
    {
      "id": "REQ-002",
      "description": "lib/analysis/allowlist.ts defines and exports an ALLOWED_PATHS constant — an explicit hard-coded array of allowed analysis paths. The readAllowedSources() function reads only those files from disk (base path: process.cwd()) and returns a key-value map. Forbidden paths (GROUND_TRUTH.md, LEGACY_FIXTURE_SPEC.md, ANALYSIS_SCOPE.md, PROPOSED_CHANGE.md, target/**) must not appear in ALLOWED_PATHS.",
      "priority": "must"
    },
    {
      "id": "REQ-003",
      "description": "lib/analysis/bundle.ts defines AnalysisBundleWireSchema as a z.object containing the five required wire sub-schemas plus optional blast_radius. The route handler validates the raw Bob response through AnalysisBundleWireSchema.safeParse() before returning any data. If validation fails the route returns HTTP 422 with { error: 'validation_failed', details: string }.",
      "priority": "must"
    },
    {
      "id": "REQ-004",
      "description": "The Bob prompt in lib/analysis/prompt.ts is a single structured request supplying the full allowed source content. The prompt explicitly states that GROUND_TRUTH.md, LEGACY_FIXTURE_SPEC.md, ANALYSIS_SCOPE.md, and PROPOSED_CHANGE.md are not available and must not include the ground-truth answer or canonical expected conclusions.",
      "priority": "must"
    },
    {
      "id": "REQ-005",
      "description": "Three LLM credentials are read exclusively from process.env server-side: BOB_API_KEY, BOB_API_URL, BOB_MODEL. No credential is passed to any client component, logged, or serialised. If BOB_API_URL or BOB_API_KEY is absent the route returns HTTP 503 with { error: 'not_configured' }.",
      "priority": "must"
    },
    {
      "id": "REQ-006",
      "description": "app/page.tsx is a Server Component that calls getMeridianReviewSession() and passes the result as initialSession prop to ReviewWorkspace. ReviewWorkspace (Client Component) renders the fixture session from initialSession (labelled FIXTURE), exposes an ANALYZE CHANGE button, disables the button while a request is in-flight to prevent duplicate requests, calls fetch('/api/analyze') on click, shows honest four-stage progress (preparing → analyzing → validating → complete), on success replaces the session with live data labelled LIVE, and on failure shows a controlled error — never silently substituting fixture data for live.",
      "priority": "must"
    },
    {
      "id": "REQ-007",
      "description": "ReviewHeader receives a new optional analysisMode prop of type 'fixture' | 'live' and renders a visible badge: 'LIVE BOB ANALYSIS' (accent color) for live mode, 'DEVELOPMENT FIXTURE' (muted/warning color) for fixture mode. When analysisMode is undefined no badge is rendered.",
      "priority": "must"
    },
    {
      "id": "REQ-008",
      "description": "app/components/AnalysisProgress.tsx renders the pipeline stages: preparing | analyzing | validating | complete | error. The 'analyzing' stage copy reads 'IBM Bob analyzing...' verbatim. No fake sub-agent stages are shown. fetch() has no application-level AbortController timeout. The button remains disabled until complete or error.",
      "priority": "must"
    },
    {
      "id": "REQ-009",
      "description": "If the Bob response is structurally valid JSON but fails Zod schema validation, the UI displays an explicit error message ('Analysis returned malformed data — results not displayed. Use DEVELOPMENT FIXTURE mode.') and does NOT substitute fixture data.",
      "priority": "must"
    },
    {
      "id": "REQ-010",
      "description": "An .env.example file is created with three placeholder entries: BOB_API_URL=https://api.us-east.bob.ibm.com/inference/v1, BOB_API_KEY=your_ibm_bob_api_key_here, BOB_MODEL=your_bob_model_id_here. No real credential appears anywhere in the repository.",
      "priority": "must"
    },
    {
      "id": "REQ-011",
      "description": "The route handler returns an X-Analysis-Mode: live response header on HTTP 200 so the client can distinguish live results from fixture results.",
      "priority": "must"
    },
    {
      "id": "REQ-012",
      "description": "All new tests mock the external LLM call using vitest mock/spy. No real network request to any LLM API is made during npm test.",
      "priority": "must"
    },
    {
      "id": "REQ-013",
      "description": "The existing getMeridianReviewSession() function in lib/review-workspace/loader.ts is preserved unchanged. Fixture mode continues to use it directly.",
      "priority": "must"
    },
    {
      "id": "REQ-014",
      "description": "After AnalysisBundleWireSchema validation passes, each sub-schema is mapped to its existing domain model via the existing fromWireFormat functions. No new mapping logic is introduced for the five existing contract types.",
      "priority": "must"
    },
    {
      "id": "REQ-015",
      "description": "lib/analysis/bob-client.ts exports callBobAnalysis(sources) using an isolated bobFetch() helper that constructs the Authorization: Bearer {BOB_API_KEY} header and POST {BOB_API_URL}/chat/completions request in one place. Request body uses OpenAI-compatible messages structure and includes response_format: { type: 'json_object' }. Single endpoint only — no auto-detection of provider from URL, no IAM token exchange, no watsonx.ai format.",
      "priority": "must"
    },
    {
      "id": "REQ-016",
      "description": "AnalysisBundleWireSchema includes blast_radius as an optional field (BlastRadiusResultWireSchema.optional()). If present in the Bob response it is parsed and stored in the live session state. No new UI component renders it in this feature.",
      "priority": "should"
    }
  ],
  "non_requirements": [
    "No GitHub App, OAuth, PR API, or webhook integration",
    "No database, persistent store, or session management",
    "No authentication or multi-user support",
    "No multi-agent swarm — one Bob LLM call only",
    "No MCP server, vector database, RAG, or embeddings",
    "No new UI design system or layout restructuring beyond the mode badge and progress component",
    "No automatic execution of the Bob-generated guardrail test code",
    "No deployment pipeline changes",
    "No Vercel maxDuration or platform-specific timeout configuration",
    "No IBM Cloud IAM token exchange or watsonx.ai format",
    "No provider auto-detection from BOB_API_URL prefix",
    "No redesign of existing UI components (FindingsPane, DiffPane, IntentPanel, GuardrailTestView)",
    "No changes to frozen Meridian fixture files (demo/legacy-billing/src/**, pom.xml, proposed-change.patch)",
    "No changes to existing fixture JSON files in lib/analysis/fixtures/",
    "No changes to existing frozen schema files (types.ts, parser.ts, review.ts, intent.ts, blast-radius.ts, guardrail-test.ts, metadata.ts)",
    "No removal of the fixture mode or existing tests",
    "No server-side streaming or WebSocket support",
    "No changes to lib/review-workspace/loader.ts, diff.ts, confidence.ts, evidence-format.ts"
  ],
  "allowed_paths": [
    "app/page.tsx",
    "app/api/analyze/route.ts",
    "app/components/ReviewWorkspace.tsx",
    "app/components/AnalysisProgress.tsx",
    "app/components/ReviewHeader.tsx",
    "lib/analysis/allowlist.ts",
    "lib/analysis/bundle.ts",
    "lib/analysis/bob-client.ts",
    "lib/analysis/prompt.ts",
    "lib/analysis/__tests__/allowlist.test.ts",
    "lib/analysis/__tests__/bundle.test.ts",
    "lib/analysis/__tests__/bob-pipeline.test.ts",
    ".env.example"
  ],
  "forbidden_paths": [
    "demo/legacy-billing/GROUND_TRUTH.md",
    "demo/legacy-billing/LEGACY_FIXTURE_SPEC.md",
    "demo/legacy-billing/ANALYSIS_SCOPE.md",
    "demo/legacy-billing/PROPOSED_CHANGE.md",
    "demo/legacy-billing/target/**",
    "lib/analysis/fixtures/**",
    "lib/analysis/types.ts",
    "lib/analysis/parser.ts",
    "lib/analysis/review.ts",
    "lib/analysis/intent.ts",
    "lib/analysis/blast-radius.ts",
    "lib/analysis/guardrail-test.ts",
    "lib/analysis/metadata.ts",
    "lib/review-workspace/loader.ts",
    "lib/review-workspace/diff.ts",
    "lib/review-workspace/confidence.ts",
    "lib/review-workspace/evidence-format.ts",
    ".agent/**",
    ".env",
    ".env.*"
  ],
  "expected_files": {
    "created": [
      "lib/analysis/allowlist.ts",
      "lib/analysis/bundle.ts",
      "lib/analysis/bob-client.ts",
      "lib/analysis/prompt.ts",
      "app/api/analyze/route.ts",
      "app/components/ReviewWorkspace.tsx",
      "app/components/AnalysisProgress.tsx",
      "lib/analysis/__tests__/allowlist.test.ts",
      "lib/analysis/__tests__/bundle.test.ts",
      "lib/analysis/__tests__/bob-pipeline.test.ts",
      ".env.example"
    ],
    "modified": [
      "app/page.tsx",
      "app/components/ReviewHeader.tsx"
    ],
    "deleted": []
  },
  "dependencies": {
    "runtime": [],
    "dev": []
  },
  "test_requirements": [
    {
      "id": "TEST-601",
      "description": "readAllowedSources() returns a map containing content for all allowlisted Java source and test files, pom.xml, and proposed-change.patch.",
      "type": "unit",
      "requirement_ref": "REQ-002"
    },
    {